Service_name,Service_url,Main_Services,Other_Services,Serving,Phone_Number,Website,Location_Address,Location_URL_Map,Eligibility,Availability,Description,Languages,Cost,Google_Review,Facebook_URL,Twitter_URL,Coverage,Latitude,Longitude,Zipcode,24hour,Monday,Tuesday,Wednesday,Thursday,Friday,Saturday,Sunday,Google_Reviews,Service_Type
"Metanoia Refuge (Metanoia, Inc.)",https://www.auntbertha.com//metanoia%252C-inc.--zachary-la--metanoia-refuge/5811770958675968?postal=92620,"['temporary shelter', 'immediate safety']","['addiction & recovery', 'dental care', 'medical care', 'mental health care', 'medications for mental health', 'navigating the system', 'spiritual support', 'alternative education', 'skills & training']","['teens', 'children', 'female', 'pregnant', 'with children', 'trauma survivors', 'abuse or neglect survivors', 'human trafficking survivors']",,https://www.metanoia-inc.org/services,,,"['This program serves female adolescent victims of human trafficking.', 'Must not be HIV-positive.', 'This program helps people who are 11 to 17 years old.']",available,"Metanoia offers a place of refuge to female adolescent victims of human trafficking, in which to heal physically and mentally. The program provides girls aged 11-17 with mental, physical, and spiritual health, instruction in academics, life skills, and job training. Once girls reach 18, they can decide whether or not they would like to continue on with the program for additional time.This program provides:- Residential recovery housing Additional services include:- Academic assessments and individualized appropriate curriculum- Individual and group therapy (mental health, substance abuse, equine, canine)- Life skills training- Spiritual guidance (religious activities not required)- Community volunteer opportunities- Health care (medical and dental)- Psychiatric assessment and management of medication- Field Trips- Art, sewing, cooking skills, creative writing, dance, sports, and gardening activities- Employment skills introduction and transitional planningCase managers, service providers, legal guardians, and law enforcement referrals may be made on behalf of the youth. Metanoia assessment forms are required to be completed for consideration to the program. Duration of the stay is as long as needed, until age 18 or 21 with extended foster care. Emergency placement is not provided.Clients across the country are offered free transportation to get to the facility.","['English', 'French', 'Italian', 'Malayalam', 'Spanish', 'Tagalog']",Free,True,,,"This program covers residents of the following states: AK, AL, AR, AZ, CA, CO, CT, DC, DE, FL, GA, HI, IA, ID, IL, IN, KS, KY, LA, MA, MD, ME, MI, MN, MO, MS, MT, NC, ND, NE, NH, NJ, NM, NV, NY, OH, OK, OR, PA, RI, SC, SD, TN, TX, UT, VA, VT, WA, WI, WV and WY.",,,,False,11:00AM – 20:00PM,11:00AM – 20:00PM,11:00AM – 20:00PM,11:00AM – 20:00PM,11:00AM – 20:00PM,Closed,Closed,,Shelter
Housing Services for Homeless Families and At-Risk Families (Family Solutions Collaborative OC),https://www.auntbertha.com//family-solutions-collaborative-oc--santa-ana-ca--housing-services-for-homeless-families-and-at-risk-families/4970850761310208?postal=92620,"['help pay for housing', 'temporary shelter', 'help find housing', 'housing vouchers', 'navigating the system']",,"['all ages', 'pregnant', 'families', 'with children', 'homeless', 'near homeless']",,https://www.familysolutionscollaborative.org/help/,,,"['Must be staying in Orange County, CA.', 'Must have at least one minor child with you aged 17 years or younger OR be currently pregnant.', 'Must be homeless OR at-risk of becoming homeless.']",available,"As the family homeless response system in Orange County, the  Family Solutions Collaborative provides a streamlined, equitable and timely process for families currently experiencing homelessness or at risk of becoming homeless to be connected to the services they need to a family Access Point in their immediate geographical area. Use the Family Service Request Form to get connected, can be found here: https://www.familysolutionscollaborative.org/help/ This program provides:- Connection to family emergency shelter- Connection to a family Access Point to provide support and navigation services to find housing resources- Access to the Orange County Family Coordinated Entry System through the family Access PointFamilies may be eligible to receive the following Housing services:- Rental Assistance- Referrals to Shelter- Navigation and referrals to Housing Programs- Referrals to other supportive services (food pantries, mainstream benefits, healthcare, etc.)Please complete the confidential online Family Service Request and you will be contacted within two business days. Forms may be completed by someone working to support/assist the family (Family Resource Center, Public Health Nurse, Social Service Provider, family/friend, with their permission). https://www.familysolutionscollaborative.org/help/Families are eligible who are homeless (living in their car or on the street, in a shed/storage unit or other place not meant for human habitation, or are staying in a motel that is being paid for by a third party such as a Church or social service agency).","['English', 'Spanish', 'Vietnamese']",Free,True,https://www.facebook.com/familysolutionscollaborative/,,"This program covers residents of the following counties: Orange County, CA.",,,,False,11:00AM – 20:00PM,11:00AM – 20:00PM,11:00AM – 20:00PM,11:00AM – 20:00PM,11:00AM – 20:00PM,Closed,Closed,,Shelter
Financial Assistance for Military Families (American Red Cross),https://www.auntbertha.com//american-red-cross--washington-dc--financial-assistance-for-military-families/5931501920976896?postal=92620,"['emergency payments', 'emergency food', 'temporary shelter', 'burial & funeral help', 'financial assistance']",,"['adults 18+', 'active duty', 'national guard', 'veterans', 'families', 'spouses', 'emergency']",877-272-7337,https://www.redcross.org/get-help/military-families/financial-assistance.html,,,"['Eligible for financial assistance if you are: An active duty service member OR', 'A member of an activated National Guard or Reserve unit OR', 'An immediate family member of a service member in the above two categories OR', 'A military retiree or spouse/widow(er) of a retiree.']",available,"The American Red Cross works in partnership with military aid societies to provide quality, reliable financial assistance to eligible applicants 24/7/365 in times of hardship.This program provides: - Financial assistance for emergency needsAssistance can include funds for emergency travel, burial of a loved one, emergency food and shelter, etc. Red Cross helps to facilitate the application process, the military aid society determines eligibility and the specific financial assistance package that is offered.You can submit a request online or call the American Red Cross Hero Care Center.  When calliing, be sure to have the following information ready to provide the representative:- Legal name- Rank or rating- Social Security number- Date of birth- Branch of service (Army, Navy, Air Force, Marines, Coast Guard)- Military unit address- Information about the deployed unit and home base unit (for deployed service members only)",['English'],Free,True,https://www.facebook.com/redcross,https://www.twitter.com/@redcross,"This program covers residents of the following states: AK, AR, AZ, CA, CO, CT, DC, DE, FL, GA, HI, IA, ID, IL, IN, KS, KY, LA, MA, MD, ME, MI, MN, MO, MS, MT, NC, ND, NE, NH, NJ, NM, NV, NY, OH, OK, OR, PA, RI, SC, SD, TN, TX, UT, VA, VT, WA, WI, WV and WY.",,,,True,,,,,,,,,Shelter
Emergency Maternity Shelter (EMS) (Casa Teresa),https://www.auntbertha.com//casa-teresa--orange-ca--emergency-maternity-shelter-%2528ems%2529/4862818456698880?postal=92620,"['temporary shelter', 'safe housing', 'residential housing', 'short-term housing']","['navigating the system', 'case management', 'one-on-one support']","['adults 18+', 'female', 'pregnant', 'individuals', 'families', 'with children', 'homeless', 'mothers', 'emergency', 'all mental health', 'substance dependency']",714-538-4860,https://casateresa.org/available-programs/,,,"['This program is for pregnant women with or without children.', 'This program helps people who are older than 17 years old.']",available,"Casa Teresa's Emergency Maternity Shelter (EMS) Program provides emergency shelter for pregnant women who are homeless, struggling with addiction, or having mental health challenges. This program is designed to stabilize the most vulnerable women in the community so they can begin to heal and prepare for motherhood. This program provides: - Emergency shelter - Short-term housing This program also includes two apartments for pregnant women with up to three children.",['English'],Free,True,,https://www.twitter.com/@CasaTeresa,"This program covers residents of the following counties: Orange County, CA.",,,,False,11:30AM – 19:30PM,11:30AM – 19:30PM,11:30AM – 19:30PM,11:30AM – 19:30PM,11:30AM – 19:30PM,Closed,Closed,,Shelter
Emergency Shelter Program (Family Promise of Orange County),https://www.auntbertha.com//family-promise-of-orange-county--orange-ca--emergency-shelter-program/4821620795375616?postal=92620,['temporary shelter'],"['meals', 'family counseling', 'individual counseling', 'navigating the system', 'case management', 'counseling', 'financial education', 'help find work']","['all ages', 'families', 'with children', 'homeless', 'emergency']",714-787-3487,https://www.familypromiseorangecounty.org/emergency-shelter,,,['This program is open to families experiencing homelessness.'],available,"Family Promise of Orange County's Emergency Shelter Program is a community-based program where families experiencing homelessness are able to immediately get off the streets and stay in local congregations while they seek employment and housing. This program provides: - Emergency shelterParticipants are provided with: - Nutritious meals - Case management - Employment counseling - Credit counseling - Financial literacy education - Family and individual therapy To apply for emergency shelter, please complete the application form on our website.",['English'],Free,True,https://www.facebook.com/ocfamilypromise,https://www.twitter.com/@ocfamilypromise,"This program covers residents of the following counties: Orange County, CA.",,,,False,11:00AM – 20:00PM,11:00AM – 20:00PM,11:00AM – 20:00PM,11:00AM – 20:00PM,11:00AM – 20:00PM,Closed,Closed,,Shelter
Behavioral Health Services (Homeless Outreach Program Integrated Care System (HOPICS)),https://www.auntbertha.com//homeless-outreach-program-integrated-care-system-%2528hopics%2529--los-angeles-ca--behavioral-health-services/5321862246039552?postal=92620,"['temporary shelter', 'help find housing', 'substance abuse counseling', 'counseling', 'mental health care']",,"['homeless', 'low-income', 'all ages', 'all mental health']",,https://www.hopics.org/,"5849 Crocker St, Los Angeles, CA 90003","https://www.google.com/maps/?q=5849+Crocker+St,+Los+Angeles,+CA+90003/",[],temporarily closed,"E6 Outreach Multi-disciplinary Teams work directly with the unhoused population. We provide supportive services, including Medical treatment, connection to primary care, income assistance, mental health service, crisis housing etc.",['English'],Free,True,https://www.facebook.com/SSGHOPICS,https://www.twitter.com/@ssghopics,"This program covers residents of the following counties: Los Angeles County, CA and Orange County, CA.",33.9882561,-118.2686678,90003.0,False,,,,,,,,,Shelter
Immediate Essential Services (Build Futures),https://www.auntbertha.com//build-futures--huntington-beach-ca--immediate-essential-services/5983755011096576?postal=92620,"['food pantry', 'temporary shelter', 'help find housing', 'transportation', 'personal hygiene', 'skills & training']",,"['young adults', 'homeless']",,https://www.buildfutures.org/,,,"['This program helps people who are 18 to 24 years old.', 'This program helps homeless youth.']",available,Build Futures offers Immediate Essential Services for homeless youth in Orange County aged 18 to 24 who are in need of support to transition from homelessness to independence. We offer:- Immediate housing- Food- Transportation- Hygiene - Job training,['English'],Free,True,https://www.facebook.com/BuildFutures,https://www.twitter.com/@buildfutures,"This program covers residents of the following counties: Orange County, CA.",,,,False,12:00PM – 20:00PM,Closed,12:00PM – 20:00PM,Closed,12:00PM – 20:00PM,Closed,Closed,,Shelter
Transitional Housing (Precious Life Shelter),https://www.auntbertha.com//precious-life-shelter--los-alamitos-ca--transitional-housing/5767553317601280?postal=92620,"['temporary shelter', 'residential housing', 'safe housing', 'short-term housing']","['health education', 'daily life skills', 'maternity care', 'postnatal care', 'navigating the system', 'case management', 'mentoring', 'one-on-one support', '12-step', 'help find work']","['adults 18+', 'female', 'pregnant', 'with children', 'homeless']",562-431-5025,https://www.preciouslifeshelter.org/transitional,,,"['This program helps people who are older than 17 years old.', 'This program helps pregnant women.', 'Women must agree to be sober or off drugs at intake.', 'Women must be motivated to be committed to a structured program.']",available,"Precious Life Shelter's Transitional Housing program serves single pregnant women who are facing an immediate financial, physical, or emotional emergency which is threatens her with loss of housing, food, or necessities for daily living. This program provides: - Short-term housing Residents are provided with: - Case management (required)- Birth coach (if needed)- Health and education classes- Family reunification after birth (if needed) - Mentor program (required)- Independent living skills - Co-dependency courses- Budgeting program- Perinatal programs - 12-step programs - On-site childcare for mothers who work, go to school, or are actively looking for work",['English'],Reduced Cost,True,https://www.facebook.com/PreciousLifeShelter/,,"This program covers residents of the following counties: Orange County, CA.",,,,False,11:00AM – 20:00PM,11:00AM – 20:00PM,11:00AM – 20:00PM,11:00AM – 20:00PM,11:00AM – 20:00PM,Closed,Closed,,Shelter