Service_name,Service_url,Main_Services,Other_Services,Serving,Phone_Number,Website,Location_Address,Location_URL_Map,Eligibility,Availability,Description,Languages,Cost,Google_Review,Facebook_URL,Twitter_URL,Coverage,Latitude,Longitude,Zipcode,24hour,Monday,Tuesday,Wednesday,Thursday,Friday,Saturday,Sunday,Google_Reviews,Service_Type
"Hearing Dog (International Hearing Dog, Inc.)",https://www.auntbertha.com//international-hearing-dog%252C-inc.--henderson-co--hearing-dog/5848751764406272?postal=92620,['support & service animals'],,"['adults 18+', 'deaf or hard of hearing']",,https://paragonservicedogs.org/hearing-dog-program,,,"['This program helps people who are older than 17 years old.', 'Must have at least a 65 decibel hearing loss (unaided).', 'Must live alone or with other persons who are deaf or hard of hearing (IHDI will consider applicants who live with one hearing person).', 'Must not have another dog in the home (inside or outside).', 'Must be  physically and financially able and willing to care for and continue the training of a hearing dog.']",full,"International Hearing Dog provides hearing dog specifically selected and trained to alert people who are deaf or hard of hearing to sounds around them so they can feel safe and live independently. Services Provided:- Professionally hearing dog training and placementHearing dogs can alert to sounds of a door knock or doorbell, telephone, alarm clock, smoke alarm, and baby cry, if needed. The dogs will naturally respond to other sounds in their environment. As the relationship develops between the Hearing Dog and owner, the dog will alert to more and more sounds. From microwave dings to garbage disposal sounds, the Hearing Dog’s ability to grow in the job is remarkable.Hearing Dogs are placed at no cost to the recipient, but the recipient will be responsible for the certification fee of $250 which includes the certification paperwork, service hearing dog vest, collar, leash, and tags.Due to the high volume of clients on our wait list, which has grown to about two to three years, IHDI is putting a hold on accepting new applications so we can serve our current applicants in a timely manner. Check back for updates and when you can apply.",['English'],Free,True,https://www.facebook.com/internationalhearingdog/,,This program covers residents of All 50 states.,,,,False,,,,,,,,,Shelter
7-Part Holistic Healing Program (The Finley Project),https://www.auntbertha.com//the-finley-project--orlando-fl--7-part-holistic-healing-program/4910146097774592?postal=92620,"['bereavement', 'burial & funeral help', 'navigating the system', 'support network', 'peer support', 'support groups']","['help pay for food', 'individual counseling', 'navigating the system']","['adults', 'young adults', 'teens', 'grieving', 'female', 'pregnant', 'mothers', 'parents']",407-463-7576,https://www.thefinleyproject.org/,,,"['Must be a mom who birthed a child', 'The age of child was over 20 weeks gestation and up to 2 years of age then died', 'The loss of your child happened within the last 60 days']",full,"The Finley Project 7-Part Holistic Healing Program team provides a lifeline for mothers in the minutes, hours and days after infant loss that supports each mother physically, emotionally and spiritually at no financial cost to them.This program provides:- Help finding assistance with funeral arrangements- Grocery and food gift cards- House cleaning services- Massage therapy sessions- Support group placement in the mother's local area- Placement with a Licensed Mental Health Counselor- A Volunteer Support Coordinator, to help in every step along the journeyThe Finley Project Program is full and will not be accepting any moms until April 1st, 2023.There is no charge to participate in the program, just a willingness to participate in all areas the program offers. While they do not offer direct financial assistance for rent, utilities, or the cost of funerals, they can connect you with organizations who do.",['English'],Free,True,https://www.facebook.com/thefinleyproject/,https://www.twitter.com/@NoelleM64407601,"This program covers residents of the following states: AK, AL, AR, AZ, CA, CO, CT, DC, DE, FL, GA, IA, ID, IL, IN, KS, KY, LA, MA, MD, ME, MI, MN, MO, MS, MT, NC, ND, NE, NH, NJ, NM, NV, NY, OH, OK, OR, PA, RI, SC, SD, TN, TX, UT, VA, VT, WA, WI, WV and WY.",,,,False,,,,,,,,,Shelter
Inpatient programs and services - Psychiatric Inpatient Program (Huntington Hospital),https://www.auntbertha.com//huntington-hospital--pasadena-ca--inpatient-programs-and-services---psychiatric-inpatient-program/5740276433289216?postal=92620,['psychiatric emergency services'],,"['adults', 'young adults', 'teens', 'seniors', 'all mental health', 'depression']",626-397-2323,https://www.huntingtonhealth.org/our-services/mental-health/,"100 W California Blvd, Pasadena, CA 91105","https://www.google.com/maps/?q=100+W+California+Blvd,+Pasadena,+CA+91105/",['This program helps people who are older than 17 years old.'],Not specified,"Huntington Hospital's mission is to provide excellent health care and compassionate service to each person by bringing together outstanding physicians, caring nurses, professional staff and advanced technologies.Psychiatric Inpatient Program provides intensive psychiatric care to voluntary adult patients with acute psychiatric disorders, such as major depression, bipolar illness or schizophrenia. Patients are immersed in intensive daily treatment, with the goal of returning them to the familiar surroundings of home as quickly as possible. Therapeutic activities focus on issues of self-awareness, family matters, social skills and personal problem solving.",['English'],Reduced Cost,False,,,"This program covers residents of the following counties: Los Angeles County, CA and Orange County, CA.",34.133639,-118.152753,91105.0,False,11:00AM – 20:00PM,11:00AM – 20:00PM,11:00AM – 20:00PM,11:00AM – 20:00PM,11:00AM – 20:00PM,Closed,Closed,,Shelter
Bartz-Altadonna Community Health Center (Bartz-Altadonna Community Health Center),https://www.auntbertha.com//bartz-altadonna-community-health-center--lancaster-ca--bartz-altadonna-community-health-center/5138359097229312?postal=92620,"['addiction & recovery', 'health education', 'family planning', 'medical care', 'primary care', 'hiv treatment', 'specialized therapy', 'individual counseling', 'parenting education']",,"['all ages', 'individuals', 'trauma survivors']",661-874-4050,http://bartz-altadonna-chc.org,"43322 Gingham Ave, Lancaster, CA 93535","https://www.google.com/maps/?q=43322+Gingham+Ave,+Lancaster,+CA+93535/",[],Not specified,"Bartz-Altadonna Community Health Center is committed to provide patient centered, trauma informed primary care services to all its patients. No one will be denied access to services due to inability to pay we offer a discounted sliding fee schedule and accept all types of health plans.Our service include: • Primary care• HIV care• Hepatitis care• Women’s Health• Reproductive Health and Family Planning• Individual Counseling• One day intensive grief and loss workshops• Art Therapy• Equine Therapy• Yoga Therapy• Healthy Attachments Group• Drug and Alcohol Dependency (Non court-ordered)• Grief and Loss Group• Brunch Club• Parenting Class• Plus other special groups for specific issues","['English', 'Spanish']",Reduced Cost,False,,,"This program covers residents of the following counties: Los Angeles County, CA and Orange County, CA.",34.6701346,-118.1217289,93535.0,False,10:30AM – 21:30PM,10:30AM – 21:30PM,10:30AM – 21:30PM,10:30AM – 21:30PM,10:30AM – 21:30PM,Closed,Closed,,Shelter
Inpatient programs and services - Psychiatric Acute Treatment Program (Huntington Hospital),https://www.auntbertha.com//huntington-hospital--pasadena-ca--inpatient-programs-and-services---psychiatric-acute-treatment-program/4862652295151616?postal=92620,['psychiatric emergency services'],,"['adults', 'young adults', 'teens', 'seniors', 'all mental health']",626-397-2323,https://www.huntingtonhealth.org/,"100 W California Blvd, Pasadena, CA 91105","https://www.google.com/maps/?q=100+W+California+Blvd,+Pasadena,+CA+91105/",['This program helps people who are older than 17 years old.'],Not specified,"Huntingdon Hospital's mission is to provide excellent health care and compassionate service to each person by bringing together outstanding physicians, caring nurses, professional staff and advanced technologies.Psychiatric Acute Treatment Program provides a secure environment for the rapid diagnosis and treatment of adults who suffer from severe psychiatric disturbances. The program emphasizes crisis intervention, patient stabilization, acute therapy and medication management. Following the initial intervention period, the patient may be discharged to home, outpatient care or a less restrictive care setting. When appropriate, families are encouraged to participate in the patient's treatment.",['English'],Reduced Cost,False,,,"This program covers residents of the following counties: Los Angeles County, CA and Orange County, CA.",34.133639,-118.152753,91105.0,False,11:00AM – 20:00PM,11:00AM – 20:00PM,11:00AM – 20:00PM,11:00AM – 20:00PM,11:00AM – 20:00PM,Closed,Closed,,Shelter
Behavioral Health Division (BHD) (Chinatown Service Center (CSC)),https://www.auntbertha.com//chinatown-service-center-%2528csc%2529--los-angeles-ca--behavioral-health-division-%2528bhd%2529/5023816127873024?postal=92620,"['counseling', 'in-home support', 'anger management', 'family counseling', 'individual counseling', 'navigating the system', 'one-on-one support', 'parenting education']",,"['all ages', 'immigrants', 'refugees', 'families', 'depression']",213-808-1792,http://www.cscla.org/behavioral,"320 South Garfield Avenue, Alhambra, CA 91801","https://www.google.com/maps/?q=320+South+Garfield+Avenue,+Alhambra,+CA+91801/",['Must have Medi-Cal and MediCare.'],Not specified,"Chinatown Service Center’s Behavioral Health Division (BHD) is committed to provide professional counseling and case management services with cultural and language sensitivity.BHD provides mental health services by Licensed Clinical Social Workers (LCSW), Licensed Marriage and Family Therapists (LMFT), registered MSW and MFT interns.Counseling services for those who do not qualify under insurance, HWLA or DCFS funding are provided by a sliding fee scale based on income level and family size.Counseling: Service is offered on a walk-in basis or through referrals in conjunction with patient referrals from the health clinics addressing depression, medication management, dual diagnosis and substance abuse issues.o  Individual counselingo  Marital counselingo  Family counselingo  Group counselingo  Parenting class - Certified to meet the requirement of DCFS for parents who are fulfilling court orders.In-Home Services and Parent Education: Family Preservation, Prevention and Aftercare, and CAPIT are LA County Department of Children and Family Services funded programs. Services include:o  In-home serviceso  Case managemento  Assist parents in understanding the developmental stages children go through, as well as appropriate boundary setting and discipline techniques.Domestic Violence Counselingo  Domestic Violence/ Anger management class for perpetrators.Los Angeles County Probation Department approved, accept court-ordered cases.o  Counseling for victim/ Referral to shelters",['English'],Reduced Cost,False,https://www.facebook.com/cscla.org/,https://www.twitter.com/@cscla_info,"This program covers residents of the following counties: Los Angeles County, CA and Orange County, CA.",34.0920385,-118.1243538,91801.0,False,11:30AM – 20:00PM,11:30AM – 20:00PM,11:30AM – 20:00PM,11:30AM – 20:00PM,11:30AM – 20:00PM,Closed,Closed,,Shelter
Shelter Network (Mercy House),https://www.auntbertha.com//mercy-house--santa-ana-ca--shelter-network/5164714503962624?postal=92620,['temporary shelter'],['navigating the system'],"['adults 18+', 'individuals', 'homeless', 'near homeless']",211,https://www.mercyhouse.net/programs,,,['This program serves individuals who are homeless OR near homeless.'],available,"Mercy House operates a complete system of care designed to meet the needs of homeless and at-risk populations in every stage of their struggle by providing temporary shelter and support services to meet the needs of individuals in need. This programs is designed with understanding of homeless services across Orange, Riverside, Los Angeles, Kern, and Ventura Counties in California and Maricopa County, Arizona. This program provides:- Temporary shelterAdditional services include:- Resource navigation servicesPlease note, services are offered through a coordinated entry point. Contact 211 to initiate care.",['English'],Free,True,https://www.facebook.com/MercyHouseLC,https://www.twitter.com/@MercyHouseLC,"This program covers residents of the following counties: Maricopa County, AZ, Kern County, CA, Los Angeles County, CA, Orange County, CA, Riverside County, CA and Ventura County, CA.",,,,True,,,,,,,,,Shelter
Emergency Shelter (Human Options),https://www.auntbertha.com//human-options--santa-ana-ca--emergency-shelter/5914866535628800?postal=92620,"['temporary shelter', 'immediate safety', 'help escape violence']","['group therapy', 'individual counseling', 'case management', 'advocacy & legal aid']","['all ages', 'children', 'female', 'individuals', 'families', 'domestic violence survivors', 'in crisis', 'emergency']",877-854-3594,http://humanoptions.org/services/?v=sd-tab-emergency-shelter,,,[],available,"Human Options' Emergency Shelter provides 24/7 services to any individual or family in a domestic violence situation seeking shelter.This program provides:- Temporary shelterClients may receive:- Individual counseling- Group counseling- Case management- Legal advocacy - Children's program Once at the shelter, victims are offered a comprehensive array of services designed to help them in establishing an independent, safe and secure life apart from their abuser.",['English'],Free,True,https://www.facebook.com/humanoptions,https://www.twitter.com/@HumanOptions,"This program covers residents of the following counties: Orange County, CA.",,,,True,,,,,,,,,Shelter
Recuperative Care (Illumination Foundation (IF)),https://www.auntbertha.com//illumination-foundation-%2528if%2529--orange-ca--recuperative-care/5078108084109312?postal=92620,"['temporary shelter', 'prevent & treat']","['meals', 'help find housing', 'transportation', 'case management']","['adults', 'young adults', 'teens', 'children', 'seniors', 'undocumented', 'limited mobility', 'post-treatment', 'individuals', 'homeless']",949-273-0555,https://ifrecuperativecare.com/how-the-program-works/,,,"['Must be referred to the program by a medical or mental health hospital.', 'Must be a homeless patient being discharged from a medical or mental health facility, and must be able to perform their activities of daily living (ADLs) without any assistance.']",available,"The Recuperative Care Program offers homeless patients a safe play to stay and recover after being discharged from the hospital in a clean, safe, and supportive shelter environment. This program seeks to end homelessness through medical stabilization of clients, crucial wraparound services, client-centered education, and housing options.This program provides:- Temporary shelterShelter services include: - Meals- Intensive case management from Medical Coordinators and Case managers - Transportation to social, medical, and mental health appointments.The Recuperative Care Program is not open to the public. All clients must be homeless and referred to the program by a medical or mental health hospital. Ask your hospital discharge planner about Illumination Foundation Recuperative Care when discussing your discharge plan.",['English'],Free,True,https://www.facebook.com/ifhomeless/,https://www.twitter.com/@IFhomeless,"This program covers residents of the following counties: Orange County, CA.",,,,False,11:00AM – 20:00PM,11:00AM – 20:00PM,11:00AM – 20:00PM,11:00AM – 20:00PM,11:00AM – 20:00PM,Closed,Closed,,Shelter
Rescued and Restored Housing (Grandma’s House of Hope),https://www.auntbertha.com//grandmas-house-of-hope--garden-grove-ca--rescued-and-restored-housing/6544370966724608?postal=92620,"['temporary shelter', 'safe housing', 'short-term housing']","['emergency food', 'clothing', 'counseling', 'group therapy', 'individual counseling', 'navigating the system', 'case management', 'mentoring', 'daily life skills']","['adults 18+', 'female', 'lgbtqia+', 'male', 'individuals', 'families', 'with children', 'homeless', 'low-income']",714-455-9528,https://www.grandmashouseofhope.org/housing,,,"['This program helps people who are older than 17 years old.', ""Program is for both women and men (unaccompanied adults only). Men's program is REFERRAL BASED ONLY."", 'This program serves at-risk children and their families, and unhoused adults.']",available,"Grandma's House of Hope provides safe, confidential emergency and transitional shelter/housing for at-risk children and their families, and restorative services for unhoused adults, create stronger, more confident, and autonomous individuals—with the goal of stable permanent housing.This program provides:- Warm homes for emergency, transitional, and bridge housing- Physical resources like food, and clothing- Case management- Housing navigation- Group and individual counseling- Career mentorship- House meetings to foster community- Life-skills workshops in areas like meal prep, cleaning, fixing, budgeting, medication management",['English'],Free,True,https://www.facebook.com/GrandmasHouseofHope,https://www.twitter.com/@GmasHouseOfHope,"This program covers residents of the following counties: Orange County, CA.",,,,False,12:00PM – 20:00PM,12:00PM – 20:00PM,12:00PM – 20:00PM,12:00PM – 20:00PM,12:00PM – 20:00PM,Closed,Closed,,Shelter
Bridge Housing (Radiant Futures),https://www.auntbertha.com//radiant-futures--fullerton-ca--bridge-housing/5279806390272000?postal=92620,"['temporary shelter', 'immediate safety', 'long-term housing', 'short-term housing']","['meals', 'help find housing', 'clothing', 'personal care items', 'counseling', 'help fill out forms', 'case management', 'one-on-one support', 'advocacy & legal aid']","['adults 18+', 'individuals', 'families', 'with children', 'trauma survivors', 'domestic violence survivors', 'emergency']",877-531-5522,https://radiantfutures.org/residential/,,,['This program helps people who are older than 17 years old.'],available,"Radiant Futures Bridge Housing is the largest residential program in Orange County for survivors of domestic violence and human trafficking. This program provides:- Temporary shelterResidents have access to services including:- Case management services- Food, clothing, toiletries, and other basic needs during stay- Group, individual, and family therapeutic services- Help find housing- Housing advocates- Legal advocatesSurvivors’ pets are able to join their owners in shelter, either sharing a living space or staying in an insulated outdoor kennel. They also offer an infant/toddler program that promotes social skill development, motor skill development and proper nutrition.","['English', 'Spanish']",Free,True,https://www.facebook.com/RadiantFutures,,"This program covers residents of the following counties: Orange County, CA.",,,,True,,,,,,,,,Shelter
"Shelters for Victims of Domestic Violence, Abuse and Human Trafficking (1736 Family Crisis Center)",https://www.auntbertha.com//1736-family-crisis-center--torrance-ca--shelters-for-victims-of-domestic-violence%252C-abuse-and-human-trafficking/5159839464423424?postal=92620,"['temporary shelter', 'help escape violence', 'safe housing', 'case management']","['meals', 'home goods', 'personal care items', 'personal hygiene', 'group therapy', 'skills & training']","['all ages', 'pregnant', 'with children', 'limited english', 'domestic violence survivors', 'emergency']",213-745-6434,https://www.1736fcc.org/programs/residential-programs-dv-human-trafficking,"21707 Hawthorne Boulevard, Torrance, CA 90503","https://www.google.com/maps/?q=21707+Hawthorne+Boulevard,+Torrance,+CA+90503/",['Serves mothers and their children (ages birth through 17) fleeing from domestic violence.'],available,"1736 Family Crisis Center offers four confidentially-located domestic violence/human trafficking shelters provide safety and refuge for survivors and their children (ages birth through 17) while staff help them to develop plans for safe and stable futures.This program provides:- Transitional Shelter- Case management- Counseling- Support groups in English and Spanish- Job development and Placement- Legal help- Life skills training- Financial literacy- Parenting education- Referrals for free medical and access to other need based services24-hours a day, every day they will take in those needing shelter.","['English', 'Spanish']",Free,True,,,"This program covers residents of the following counties: Los Angeles County, CA, Orange County, CA, Riverside County, CA, San Bernardino County, CA and Ventura County, CA.",33.8305456,-118.3529484,90503.0,False,12:00PM – 20:00PM,12:00PM – 20:00PM,12:00PM – 20:00PM,12:00PM – 20:00PM,12:00PM – 20:00PM,Closed,Closed,,Shelter
Homeless Veterans Initiative (Disabled American Veterans (DAV)),https://www.auntbertha.com//disabled-american-veterans-%2528dav%2529--cold-spring-ky--homeless-veterans-initiative/6359041064304640?postal=92620,"['temporary shelter', 'government benefits']",,['veterans'],877-426-2838,https://www.dav.org/get-help-now/veteran-topics-resources/homeless-veterans-assistance/,,,['Serves homeless veterans.'],available,"The DAV Homeless Veterans Initiative, supported by DAV’s Charitable Service Trust and Columbia Trust, promotes the development of supportive housing and necessary services to assist homeless veterans in becoming productive, self-sufficient members of society. Our goal is to establish a partnership between the DAV and Federal, state, county and local governments to develop programs to assist homeless veterans in becoming self-sufficient. Service: -counsel individuals on the many VA benefits for which they may be entitled. If you or someone you know is a homeless veteran in need of assistance, please contact us.",['English'],Free,True,https://www.facebook.com/DAV,https://www.twitter.com/@DAVHQ,This program covers residents of All US states and territories.,,,,False,08:00AM – 17:00PM,08:00AM – 17:00PM,08:00AM – 17:00PM,08:00AM – 17:00PM,08:00AM – 17:00PM,Closed,Closed,,Shelter
JFS Hope - Assistance for Domestic Violence Survivors (Jewish Family Service of Los Angeles (JFSLA)),https://www.auntbertha.com//jewish-family-service-of-los-angeles-%2528jfsla%2529--los-angeles-ca--jfs-hope---assistance-for-domestic-violence-survivors/5415458811412480?postal=92620,"['temporary shelter', 'immediate safety', 'short-term housing', 'navigating the system', 'case management', 'support network', 'counseling', 'help hotlines', 'support groups', 'virtual support', 'more education', 'advocacy & legal aid']",,"['all ages', 'individuals', 'families', 'domestic violence survivors', 'in crisis', 'emergency']",818-505-0900,https://www.jfsla.org/our-services/domestic-violence/,,,['This program serves domestic violence survivors.'],available,"Jewish Family Service of Los Angeles (JFSLA) offers assistance and crisis services to support survivors of domestic violence.This program provides:- Two 24-hour crisis lines- Domestic Violence Shelter- Domestic Violence Counseling & SupportAll shelter residency requests, counseling center appointments, information, and referrals are handled via the 24-hour crisis lines: 818-505-0900 or 323-681-2626.","['English', 'Spanish']",Free,True,https://www.facebook.com/JFSLA,https://www.twitter.com/@jfsla,"This program covers residents of the following counties: Los Angeles County, CA, Orange County, CA, Riverside County, CA, San Bernardino County, CA and Ventura County, CA.",,,,False,11:00AM – 20:00PM,11:00AM – 20:00PM,11:00AM – 20:00PM,11:00AM – 20:00PM,11:00AM – 20:00PM,Closed,Closed,,Shelter
Emergency Youth Shelter (1736 Family Crisis Center),https://www.auntbertha.com//1736-family-crisis-center--los-angeles-ca--emergency-youth-shelter/4816089525518336?postal=92620,"['temporary shelter', 'immediate safety']","['meals', 'home goods', 'personal care items', 'individual counseling']","['teens', 'children', 'homeless', 'runaways', 'emergency']",310-379-3620,https://www.1736fcc.org/programs/residential-programs-dv-human-trafficking,,,['This program helps people who are 10 to 17 years old.'],available,"Emergency Youth Shelter Program provides runaway and homeless boys and girls ages 10 through 17 for a shelter stay of up to two weeks. This program provides:- Emergency shelterOther assistance includes:- Food & Clothing- Individual and group counseling- Medical services- Legal help and long-term safety plansAfter a participant graduates from the Youth Shelter, their goal is to make sure that the youth exit into safe, long-term housing, whether that is reunification with their parents or another appropriate arrangement. A six-month aftercare follow-up period is also in place so that staff can stay in touch to provide whatever support a they might need to stay on track.",['English'],Free,True,https://www.facebook.com/1736FamilyCrisisCenter/,https://www.twitter.com/@1736fcc,"This program covers residents of the following counties: Los Angeles County, CA, Orange County, CA, Riverside County, CA, San Bernardino County, CA and Ventura County, CA.",,,,True,,,,,,,,,Shelter
